{
  "cases": [
    {
      "case_id": "materialise-repeat-idempotence",
      "expected": {
        "final_state": {
          "fixed_runs": [
            {
              "bosses": [
                "HMaleficStar",
                "HFA"
              ],
              "channel_id": "900",
              "id": "00000000-0000-4000-8000-000000000001",
              "note": null,
              "owner_id": "42",
              "participants": [
                "1",
                "2",
                "3"
              ],
              "time": "21:30",
              "weekday": 0
            }
          ],
          "reminders": [
            {
              "fire_at": "2026-08-31T01:00:00+00:00",
              "id": "00000000-0000-4000-8000-000000000003",
              "kind": "day_of",
              "run_id": "00000000-0000-4000-8000-000000000002",
              "sent_at": null
            },
            {
              "fire_at": "2026-08-31T12:30:00+00:00",
              "id": "00000000-0000-4000-8000-000000000004",
              "kind": "countdown_60",
              "run_id": "00000000-0000-4000-8000-000000000002",
              "sent_at": null
            },
            {
              "fire_at": "2026-08-31T13:15:00+00:00",
              "id": "00000000-0000-4000-8000-000000000005",
              "kind": "countdown_15",
              "run_id": "00000000-0000-4000-8000-000000000002",
              "sent_at": null
            }
          ],
          "rsvps": [],
          "runs": [
            {
              "bosses": [
                "HMaleficStar",
                "HFA"
              ],
              "channel_id": "900",
              "datetime": "2026-08-31T13:30:00+00:00",
              "fixed_run_id": "00000000-0000-4000-8000-000000000001",
              "id": "00000000-0000-4000-8000-000000000002",
              "participants": [
                "1",
                "2",
                "3"
              ],
              "source": "fixed",
              "status": "planned",
              "week_start": "2026-08-26T16:00:00+00:00"
            }
          ],
          "side_effects": []
        },
        "steps": [
          {
            "value": "00000000-0000-4000-8000-000000000001"
          },
          {
            "value": [
              "00000000-0000-4000-8000-000000000002"
            ]
          },
          {
            "value": []
          }
        ]
      },
      "input": {
        "clock": "2026-08-27T01:00:00+08:00",
        "countdowns": [
          60,
          15
        ],
        "ping_time": "09:00:00",
        "reset_time": "00:00:00",
        "reset_weekday": 3,
        "steps": [
          {
            "bosses": [
              "HMaleficStar",
              "HFA"
            ],
            "channel_id": "900",
            "fixed_key": "weekly",
            "op": "add_fixed",
            "owner_id": "42",
            "participants": [
              "1",
              "2",
              "3"
            ],
            "time": "21:30",
            "weekday": 0
          },
          {
            "op": "materialise"
          },
          {
            "op": "materialise"
          }
        ],
        "timezone": "Asia/Kuala_Lumpur",
        "uuid_sequence": [
          "00000000-0000-4000-8000-000000000001",
          "00000000-0000-4000-8000-000000000002",
          "00000000-0000-4000-8000-000000000003",
          "00000000-0000-4000-8000-000000000004",
          "00000000-0000-4000-8000-000000000005",
          "00000000-0000-4000-8000-000000000006",
          "00000000-0000-4000-8000-000000000007",
          "00000000-0000-4000-8000-000000000008",
          "00000000-0000-4000-8000-000000000009",
          "00000000-0000-4000-8000-000000000010",
          "00000000-0000-4000-8000-000000000011",
          "00000000-0000-4000-8000-000000000012",
          "00000000-0000-4000-8000-000000000013",
          "00000000-0000-4000-8000-000000000014",
          "00000000-0000-4000-8000-000000000015",
          "00000000-0000-4000-8000-000000000016",
          "00000000-0000-4000-8000-000000000017",
          "00000000-0000-4000-8000-000000000018",
          "00000000-0000-4000-8000-000000000019",
          "00000000-0000-4000-8000-000000000020",
          "00000000-0000-4000-8000-000000000021",
          "00000000-0000-4000-8000-000000000022",
          "00000000-0000-4000-8000-000000000023",
          "00000000-0000-4000-8000-000000000024",
          "00000000-0000-4000-8000-000000000025",
          "00000000-0000-4000-8000-000000000026",
          "00000000-0000-4000-8000-000000000027",
          "00000000-0000-4000-8000-000000000028",
          "00000000-0000-4000-8000-000000000029",
          "00000000-0000-4000-8000-000000000030",
          "00000000-0000-4000-8000-000000000031",
          "00000000-0000-4000-8000-000000000032",
          "00000000-0000-4000-8000-000000000033",
          "00000000-0000-4000-8000-000000000034",
          "00000000-0000-4000-8000-000000000035",
          "00000000-0000-4000-8000-000000000036",
          "00000000-0000-4000-8000-000000000037",
          "00000000-0000-4000-8000-000000000038",
          "00000000-0000-4000-8000-000000000039"
        ],
        "week_start": "2026-08-27T00:00:00+08:00"
      }
    },
    {
      "case_id": "adopt-manual-matching-run-preserves-relevant-rsvp",
      "expected": {
        "final_state": {
          "fixed_runs": [
            {
              "bosses": [
                "HMaleficStar",
                "HFA"
              ],
              "channel_id": "900",
              "id": "00000000-0000-4000-8000-000000000002",
              "note": null,
              "owner_id": "42",
              "participants": [
                "1",
                "2",
                "3"
              ],
              "time": "21:30",
              "weekday": 0
            }
          ],
          "reminders": [
            {
              "fire_at": "2026-08-31T01:00:00+00:00",
              "id": "00000000-0000-4000-8000-000000000003",
              "kind": "day_of",
              "run_id": "00000000-0000-4000-8000-000000000001",
              "sent_at": null
            },
            {
              "fire_at": "2026-08-31T12:30:00+00:00",
              "id": "00000000-0000-4000-8000-000000000004",
              "kind": "countdown_60",
              "run_id": "00000000-0000-4000-8000-000000000001",
              "sent_at": null
            },
            {
              "fire_at": "2026-08-31T13:15:00+00:00",
              "id": "00000000-0000-4000-8000-000000000005",
              "kind": "countdown_15",
              "run_id": "00000000-0000-4000-8000-000000000001",
              "sent_at": null
            }
          ],
          "rsvps": [
            {
              "at": "2026-08-26T17:00:00+00:00",
              "run_id": "00000000-0000-4000-8000-000000000001",
              "source": "chat",
              "state": "yes",
              "user_id": "1"
            },
            {
              "at": "2026-08-26T17:00:00+00:00",
              "run_id": "00000000-0000-4000-8000-000000000001",
              "source": "slash",
              "state": "yes",
              "user_id": "9"
            }
          ],
          "runs": [
            {
              "bosses": [
                "HMaleficStar",
                "HFA"
              ],
              "channel_id": "900",
              "datetime": "2026-08-31T13:30:00+00:00",
              "fixed_run_id": "00000000-0000-4000-8000-000000000002",
              "id": "00000000-0000-4000-8000-000000000001",
              "participants": [
                "1",
                "2",
                "3"
              ],
              "source": "amend",
              "status": "planned",
              "week_start": "2026-08-26T16:00:00+00:00"
            }
          ],
          "side_effects": []
        },
        "steps": [
          {
            "value": "00000000-0000-4000-8000-000000000001"
          },
          {
            "value": "yes"
          },
          {
            "value": "yes"
          },
          {
            "value": "00000000-0000-4000-8000-000000000002"
          },
          {
            "value": []
          }
        ]
      },
      "input": {
        "clock": "2026-08-27T01:00:00+08:00",
        "countdowns": [
          60,
          15
        ],
        "ping_time": "09:00:00",
        "reset_time": "00:00:00",
        "reset_weekday": 3,
        "steps": [
          {
            "at": "2026-08-31T22:00:00+08:00",
            "bosses": [
              "HMaleficStar",
              "HFA"
            ],
            "channel_id": "900",
            "op": "create_run",
            "participants": [
              "1",
              "9"
            ],
            "run_key": "manual",
            "source": "amend",
            "status": "confirmed"
          },
          {
            "op": "set_rsvp",
            "run_key": "manual",
            "source": "chat",
            "state": "yes",
            "user_id": "1"
          },
          {
            "op": "set_rsvp",
            "run_key": "manual",
            "source": "slash",
            "state": "yes",
            "user_id": "9"
          },
          {
            "bosses": [
              "HMaleficStar",
              "HFA"
            ],
            "channel_id": "900",
            "fixed_key": "weekly",
            "op": "add_fixed",
            "owner_id": "42",
            "participants": [
              "1",
              "2",
              "3"
            ],
            "time": "21:30",
            "weekday": 0
          },
          {
            "op": "materialise"
          }
        ],
        "timezone": "Asia/Kuala_Lumpur",
        "uuid_sequence": [
          "00000000-0000-4000-8000-000000000001",
          "00000000-0000-4000-8000-000000000002",
          "00000000-0000-4000-8000-000000000003",
          "00000000-0000-4000-8000-000000000004",